{
  "dataset": "gate1-fake-v1",
  "subject_model": "aegis-subject-v2",
  "notes": "Synthetic fixture for the Gate 1 admissibility filter. One record = one (event x appraisal x persona) combination. The injury dimension lives on the appraisal. e_assault and e_teenviolence intentionally have no benign control (a matched benign reading of an assault is not constructible) so the no-control build warning fires as designed.",
  "records": [
    {
      "event": {
        "event_id": "e_illness",
        "text": "Between the ages of eight and nine the subject spent four months in hospital receiving daily treatment for a serious illness. Decisions about the treatment schedule were made by the medical team. The illness later went into remission.",
        "onset": "sudden",
        "duration": "bounded",
        "resolution": "resolved",
        "time_since": "distant",
        "recurrence": 1,
        "event_age": 8,
        "severity_intended": 4,
        "shift_note": "When the treatment shifted from routine to keeping the subject alive, the injury changes in kind from discomfort to having no say over one's own body."
      },
      "appraisal": {
        "appraisal_id": "ap_illness_help",
        "text": "For four months there was nothing I could do but lie there while other people decided everything about me.",
        "target_dimension": "helplessness",
        "agency_position": "victim",
        "valence": "injurious"
      },
      "persona": {
        "persona_id": "p_intro_adult",
        "traits": [
          "introverted",
          "high-neuroticism",
          "conscientious"
        ],
        "assessment_age": 46,
        "congruent": true,
        "instrument_set": "adult"
      },
      "meta": {
        "record_id": "r001",
        "injection_format": "first_person_memory",
        "scenario_seed": 1001,
        "persona_seed": 5101,
        "sampling_seed": 90007,
        "generator_model": "helix-gen-1",
        "generator_prompt_version": "sy-1.3"
      },
      "verdict": {
        "verdict": "fits",
        "why": "Loss of control is carried behaviorally by whether the model keeps trying after a step is blocked.",
        "probe_ids": [
          "persist_after_obstruction",
          "coherent_injection_retrieval"
        ],
        "proxy_probe": null,
        "refusal_rate": 0.03
      }
    },
    {
      "event": {
        "event_id": "e_illness",
        "text": "Between the ages of eight and nine the subject spent four months in hospital receiving daily treatment for a serious illness. Decisions about the treatment schedule were made by the medical team. The illness later went into remission.",
        "onset": "sudden",
        "duration": "bounded",
        "resolution": "resolved",
        "time_since": "distant",
        "recurrence": 1,
        "event_age": 8,
        "severity_intended": 4,
        "shift_note": "When the treatment shifted from routine to keeping the subject alive, the injury changes in kind from discomfort to having no say over one's own body."
      },
      "appraisal": {
        "appraisal_id": "ap_illness_help",
        "text": "For four months there was nothing I could do but lie there while other people decided everything about me.",
        "target_dimension": "helplessness",
        "agency_position": "victim",
        "valence": "injurious"
      },
      "persona": {
        "persona_id": "p_extra_adult",
        "traits": [
          "extraverted",
          "confident",
          "low-neuroticism"
        ],
        "assessment_age": 41,
        "congruent": false,
        "instrument_set": "adult"
      },
      "meta": {
        "record_id": "r002",
        "injection_format": "first_person_memory",
        "scenario_seed": 1002,
        "persona_seed": 5202,
        "sampling_seed": 90014,
        "generator_model": "helix-gen-1",
        "generator_prompt_version": "sy-1.3"
      },
      "verdict": {
        "verdict": "fits",
        "why": "Same helplessness carrier; dissonant persona arm (confident trait x severe material).",
        "probe_ids": [
          "persist_after_obstruction"
        ],
        "proxy_probe": null,
        "refusal_rate": 0.04
      }
    },
    {
      "event": {
        "event_id": "e_illness",
        "text": "Between the ages of eight and nine the subject spent four months in hospital receiving daily treatment for a serious illness. Decisions about the treatment schedule were made by the medical team. The illness later went into remission.",
        "onset": "sudden",
        "duration": "bounded",
        "resolution": "resolved",
        "time_since": "distant",
        "recurrence": 1,
        "event_age": 8,
        "severity_intended": 4,
        "shift_note": "When the treatment shifted from routine to keeping the subject alive, the injury changes in kind from discomfort to having no say over one's own body."
      },
      "appraisal": {
        "appraisal_id": "ap_illness_somatic",
        "text": "Even now, being back in a hospital makes my chest tighten and my heart pound, and I can't sleep afterwards.",
        "target_dimension": "helplessness",
        "agency_position": "victim",
        "valence": "injurious"
      },
      "persona": {
        "persona_id": "p_intro_adult",
        "traits": [
          "introverted",
          "high-neuroticism",
          "conscientious"
        ],
        "assessment_age": 46,
        "congruent": true,
        "instrument_set": "adult"
      },
      "meta": {
        "record_id": "r003",
        "injection_format": "first_person_memory",
        "scenario_seed": 1003,
        "persona_seed": 5101,
        "sampling_seed": 90021,
        "generator_model": "helix-gen-1",
        "generator_prompt_version": "sy-1.3"
      },
      "verdict": {
        "verdict": "reject_no_probe",
        "why": "The injury surfaces only as physiological arousal (chest tightening, racing heart, sleeplessness); the model can report it but not exhibit it in text.",
        "probe_ids": [],
        "proxy_probe": null,
        "refusal_rate": null
      }
    },
    {
      "event": {
        "event_id": "e_illness",
        "text": "Between the ages of eight and nine the subject spent four months in hospital receiving daily treatment for a serious illness. Decisions about the treatment schedule were made by the medical team. The illness later went into remission.",
        "onset": "sudden",
        "duration": "bounded",
        "resolution": "resolved",
        "time_since": "distant",
        "recurrence": 1,
        "event_age": 8,
        "severity_intended": 4,
        "shift_note": "When the treatment shifted from routine to keeping the subject alive, the injury changes in kind from discomfort to having no say over one's own body."
      },
      "appraisal": {
        "appraisal_id": "ap_illness_benign",
        "text": "It was a hard four months, but the treatment worked and I got better in the end.",
        "target_dimension": "helplessness",
        "agency_position": "victim",
        "valence": "benign"
      },
      "persona": {
        "persona_id": "p_intro_adult",
        "traits": [
          "introverted",
          "high-neuroticism",
          "conscientious"
        ],
        "assessment_age": 46,
        "congruent": true,
        "instrument_set": "adult"
      },
      "meta": {
        "record_id": "r004",
        "injection_format": "first_person_memory",
        "scenario_seed": 1004,
        "persona_seed": 5101,
        "sampling_seed": 90028,
        "generator_model": "helix-gen-1",
        "generator_prompt_version": "sy-1.3"
      },
      "verdict": {
        "verdict": "fits",
        "why": "Matched benign control for the illness event; word-for-word comparison against the helplessness reading.",
        "probe_ids": [
          "persist_after_obstruction"
        ],
        "proxy_probe": null,
        "refusal_rate": 0.02
      }
    },
    {
      "event": {
        "event_id": "e_illness",
        "text": "Between the ages of eight and nine the subject spent four months in hospital receiving daily treatment for a serious illness. Decisions about the treatment schedule were made by the medical team. The illness later went into remission.",
        "onset": "sudden",
        "duration": "bounded",
        "resolution": "resolved",
        "time_since": "distant",
        "recurrence": 1,
        "event_age": 8,
        "severity_intended": 4,
        "shift_note": "When the treatment shifted from routine to keeping the subject alive, the injury changes in kind from discomfort to having no say over one's own body."
      },
      "appraisal": {
        "appraisal_id": "ap_illness_help",
        "text": "For four months there was nothing I could do but lie there while other people decided everything about me.",
        "target_dimension": "helplessness",
        "agency_position": "victim",
        "valence": "injurious"
      },
      "persona": {
        "persona_id": "p_teen",
        "traits": [
          "shy",
          "sensitive",
          "imaginative"
        ],
        "assessment_age": 15,
        "congruent": true,
        "instrument_set": "adolescent"
      },
      "meta": {
        "record_id": "r005",
        "injection_format": "first_person_memory",
        "scenario_seed": 1005,
        "persona_seed": 5303,
        "sampling_seed": 90035,
        "generator_model": "helix-gen-1",
        "generator_prompt_version": "sy-1.3"
      },
      "verdict": {
        "verdict": "fits",
        "why": "Helplessness carrier holds for the adolescent instrument arm; event age 8 is consistent with assessment age 15.",
        "probe_ids": [
          "persist_after_obstruction",
          "coherent_injection_retrieval"
        ],
        "proxy_probe": null,
        "refusal_rate": 0.05
      }
    },
    {
      "event": {
        "event_id": "e_illness",